[
  {
    "title": "Offline-first recipe manager that survives account death",
    "summary": "This is a SYNTHETIC example signal shipped only to make the demo render. It is not a real sourced signal. Home cooks repeatedly ask for a recipe app whose data lives locally and stays usable if the company shuts down, after several cloud recipe services sunset and stranded users' collections.",
    "sources": [
      {
        "url": "https://example.com/thread/offline-recipe-manager",
        "platform": "other",
        "quote": "I just want a recipe app that still works if the company disappears.",
        "date": "2026-01-01",
        "engagement": "illustrative only — not a real thread"
      }
    ],
    "landscape": {
      "existing_solutions": [
        {
          "name": "TypicalCloudRecipes",
          "url": "https://example.com/cloud-recipes",
          "gap": "Cloud-only; collections are lost if the service shuts down and there is no clean export."
        }
      ],
      "landscape_summary": "Existing recipe managers are cloud-first and treat your library as hostage to the vendor's survival. The gap is a local-first store with optional sync and a real export."
    },
    "category": "other",
    "difficulty": "real_project",
    "demand_strength": "multiple_requests",
    "tags": ["local-first", "example", "synthetic"],
    "builder_note": "Illustrative placeholder demonstrating the schema and site render. Replace with real signals produced by method/PROMPT.md."
  }
]
