[
  {
    "title": "Batch-scan signed customer invoices and auto-file them per customer, with fuzzy name matching",
    "summary": "Small delivery-based businesses print invoices from their accounting software, get them signed on paper at the door, then hand-file the signed copy into a per-customer folder. Operators want to scan a stack, have software read the printed customer name, and drop each page into that customer's folder. The document-capture category that looks like it solves this is built for the opposite direction (supplier bills coming in, not your own signed invoices going out), and the failure everyone who has tried it reports is name variance: 'Bob's Diner' and 'Bobs Diner' silently become two folders.",
    "sources": [
      {
        "url": "https://old.reddit.com/r/smallbusiness/comments/1v991q1/scanning_software_that_automatically_sorts_and/",
        "platform": "reddit",
        "quote": "Looking for a software where I can upload/scan a batch of these paper printed invoice and for them to be automatically sorted into their own folders based on the name of the customer.",
        "date": "2026-07-28",
        "engagement": "9 points, 30 comments. Food service operator with 80-100 local customers and about 600 invoices a month. Most recent reply on the thread was posted 2026-07-30, so the discussion is still live. Also cross-posted by the same author to r/software."
      },
      {
        "url": "https://old.reddit.com/r/smallbusiness/comments/1v991q1/scanning_software_that_automatically_sorts_and/p0cbrrz/",
        "platform": "reddit",
        "quote": "the annoying part was always the naming inconsistency. If the customer name is even slightly different on the document, most auto-filing tools start breaking fast.",
        "date": "2026-07-28",
        "engagement": "Reply from a second operator describing the same workflow at their own business and naming the specific failure mode of existing auto-filing tools. Same thread as the original post, not an independent thread."
      },
      {
        "url": "https://old.reddit.com/r/smallbusiness/comments/1v991q1/scanning_software_that_automatically_sorts_and/p0mvacv/",
        "platform": "reddit",
        "quote": "did one of these once and the thing that bit me was name variance. \"Bob's Diner\" on one invoice, \"Bobs Diner\" on the next, and suddenly one customer has two folders.",
        "date": "2026-07-30",
        "engagement": "Third operator, independently reporting the identical name-variance failure from having built this themselves. Posted 2026-07-30, the newest comment on the thread at time of capture. Same thread as the original post, not an independent thread."
      }
    ],
    "landscape": {
      "existing_solutions": [
        {
          "name": "Hubdoc",
          "url": "https://www.hubdoc.com/",
          "gap": "Built around inbound paperwork: its own site describes it as putting 'all your bills and receipts in one place' and says it reads supplier names, amounts, invoice numbers and due dates off bills and receipts. It extracts the supplier on a bill you received, not the customer on an invoice you issued and had signed, and it files into an accounting workflow rather than a per-customer document folder."
        },
        {
          "name": "Dext",
          "url": "https://dext.com/",
          "gap": "Positions as bookkeeping automation with receipt and invoice capture plus Vault document storage. The organizing unit is the accounting ledger and the bookkeeping client, so it does not give a delivery business a per-customer folder of signed proof-of-delivery copies, and its capture is likewise aimed at costs coming in."
        },
        {
          "name": "Google Drive plus Apps Script",
          "url": "https://developers.google.com/apps-script",
          "gap": "Named in the thread as the DIY route and it can technically do OCR plus move-to-folder, but there is nothing off the shelf: the operator has to write the script, and it gives no fuzzy matching against a known customer list, which is precisely the part three separate people in the thread report as the thing that breaks."
        }
      ],
      "landscape_summary": "The document-capture market is overwhelmingly accounts-payable: tools are built to read supplier bills and receipts coming into the business and push them into bookkeeping. Nobody in this thread named a product that does the accounts-receivable mirror image, which is taking a batch of your own printed, hand-signed invoices and filing each one under the customer it belongs to. The specific gap is not OCR, which is solved and cheap. It is matching the extracted name against a closed list of 80 to 100 known customers with fuzzy tolerance, so that punctuation and spelling drift do not silently fork one customer into several folders. A commenter also pointed out a cheaper structural fix nobody sells: match on the invoice number, which is already printed and already unique, and attach the scan back to that invoice record instead of maintaining folders at all."
    },
    "category": "business_operations",
    "difficulty": "weekend_project",
    "demand_strength": "multiple_requests",
    "tags": ["ocr", "document-management", "small-business", "accounts-receivable", "local-first"],
    "builder_note": "The hard part is deliberately not the OCR. Printed invoice text off a flatbed scan is a solved problem with Tesseract or any cloud OCR. The product is the matching layer: import the customer list once (from QuickBooks Online, which is what this operator already uses), then fuzzy-match each extracted name against that closed list with a confidence threshold and a human review queue for anything below it. Closed-list matching is far more tractable than open-ended entity extraction, and it is the exact thing the AP-oriented incumbents do not do because their lists are suppliers, not customers. Note the honest ceiling: one thread, three operators, and two of the three are commenters rather than independent posters, so treat this as a validated annoyance rather than a proven market. Before building, check whether invoice-number matching plus the QuickBooks attachment API makes the folder problem disappear entirely, because if it does the winning product is much smaller than a document manager."
  }
]
